Condition,Symptoms,Medicine,Effectiveness,Side_Effects,Salts,Public_Review
Myositis,"Muscle weakness, Fatigue, Joint pain",Corticosteroids,High,"Weight gain, Mood swings",Various,Corticosteroids effectively manage my myositis symptoms. Some side effects but necessary for improvement.
Muscular Dystrophy,"Progressive muscle weakness, Difficulty walking",Physical Therapy,N/A,N/A,N/A,Physical therapy plays a crucial role in managing my muscular dystrophy. Ongoing effort for better mobility.
Myasthenia Gravis,"Muscle weakness, Fatigue, Difficulty swallowing",Pyridostigmine,Moderate,"Abdominal cramps, Increased saliva",Pyridostigmine,Pyridostigmine helps manage my myasthenia gravis. Some discomfort but improves muscle function.
Fibromyalgia,"Widespread muscle pain, Fatigue, Sleep disturbances",Duloxetine,Moderate,"Nausea, Insomnia",Duloxetine,Duloxetine aids in managing my fibromyalgia symptoms. Watch for potential side effects.
Compartment Syndrome,"Swelling, Severe pain, Numbness",Surgery,N/A,N/A,N/A,Surgery is often necessary to treat compartment syndrome. Effective in relieving pressure on muscles.
Muscle Atrophy,"Muscle wasting, Weakness, Loss of muscle mass",Physical Therapy,N/A,N/A,N/A,Physical therapy is crucial in managing muscle atrophy. Regular exercises help maintain muscle strength.
Rhabdomyolysis,"Muscle pain, Dark urine, Fatigue",IV Fluids,High,"Low blood pressure, Kidney damage",Various,IV fluids are crucial in treating rhabdomyolysis. Monitoring for kidney damage is essential.
Amyotrophic Lateral Sclerosis (ALS),"Muscle weakness, Difficulty speaking, Difficulty swallowing",Riluzole,Moderate,"Nausea, Liver function issues",Riluzole,Riluzole aids in managing symptoms of ALS. Some discomfort but improves quality of life.
Muscle Knots (Myofascial Trigger Points),"Localized pain, Tenderness, Restricted movement",Massage Therapy,N/A,N/A,N/A,Massage therapy is effective in relieving muscle knots. Provides relief and improved flexibility.
Herniated Disc,"Back pain, Leg pain, Numbness",Physical Therapy,N/A,N/A,N/A,Physical therapy is crucial in managing herniated disc pain. Exercises help strengthen supporting muscles.
Charcot-Marie-Tooth Disease,"Muscle weakness, Foot deformities, Difficulty walking",Orthopedic Devices,N/A,N/A,N/A,Orthopedic devices help manage the effects of Charcot-Marie-Tooth Disease. Assistive devices for better mobility.
Polymyositis,"Muscle weakness, Fatigue, Joint pain",Corticosteroids,High,"Weight gain, Mood swings",Various,Corticosteroids effectively manage my polymyositis symptoms. Some side effects but necessary for improvement.
Muscle Contusion,"Bruising, Swelling, Pain",Rest,Ice,Compression,Elevation (RICE),N/A
Muscle Cramps,"Sudden, involuntary contractions, Pain",Hydration,Electrolyte supplements,Moderate,"Upset stomach, Diarrhea",Various Hydration and electrolyte supplements help prevent muscle cramps. Some gastrointestinal discomfort but beneficial.
Alzheimer's Disease,"Memory loss, Cognitive decline, Confusion",Donepezil,High,"Nausea, Insomnia",Donepezil,"Donepezil has been effective in managing my Alzheimer's symptoms. Some initial discomfort, but improvements noticed."
Parkinson's Disease,"Tremors, Bradykinesia, Muscle rigidity",Levodopa,Carbidopa,High,"Nausea, Hallucinations",Levodopa Carbidopa Levodopa and Carbidopa combination effectively controls my Parkinson's symptoms. Side effects are manageable.
Multiple Sclerosis,"Fatigue, Weakness, Numbness",Interferon beta-1a,Moderate,"Flu-like symptoms, Injection site reactions",Interferon beta-1a,Interferon beta-1a helps in managing my multiple sclerosis. Flu-like symptoms can be challenging.
Epilepsy,"Seizures, Convulsions",Lamotrigine,Moderate,"Dizziness, Blurred vision",Lamotrigine,"Lamotrigine helps control my epilepsy seizures. Some dizziness, but overall satisfied with the medication."
Migraine,"Intense headache, Nausea, Sensitivity to light",Sumatriptan,High,"Chest pain, Tingling sensations",Sumatriptan,Sumatriptan provides quick relief during my migraines. Chest pain is a rare side effect for me.
Amyotrophic Lateral Sclerosis (ALS),"Muscle weakness, Difficulty speaking, Difficulty swallowing",Riluzole,Moderate,"Nausea, Liver function issues",Riluzole,Riluzole aids in managing symptoms of ALS. Some discomfort but improves quality of life.
Huntington's Disease,"Chorea (involuntary movements), Cognitive decline",Tetrabenazine,High,"Depression, Drowsiness",Tetrabenazine,"Tetrabenazine effectively helps control my Huntington's chorea. Some mood changes, but overall satisfied."
Stroke,"Sudden numbness, Trouble speaking, Severe headache",Aspirin,High,"Gastrointestinal bleeding, Allergic reactions",Aspirin,"Aspirin is crucial for preventing stroke recurrence. Watch for potential side effects, but it's a lifesaver."
Peripheral Neuropathy,"Numbness, Tingling, Pain in extremities",Gabapentin,Moderate,"Drowsiness, Weight gain",Gabapentin,"Gabapentin helps manage my peripheral neuropathy symptoms. Some drowsiness, but the pain relief is worth it."
Restless Legs Syndrome,"Uncomfortable sensations in legs, Urge to move legs",Pramipexole,High,"Nausea, Daytime sleepiness",Pramipexole,"Pramipexole effectively alleviates my restless legs symptoms. Some nausea, but it's manageable."
Cerebral Palsy,"Poor coordination, Muscle stiffness, Speech difficulties",Baclofen,Moderate,"Drowsiness, Weakness",Baclofen,"Baclofen helps in managing muscle stiffness due to cerebral palsy. Some drowsiness, but overall satisfied."
Neuromyelitis Optica,"Optic neuritis, Transverse myelitis",Rituximab,High,"Infusion reactions, Risk of infections",Rituximab,Rituximab has been effective in managing my neuromyelitis optica. Infusion reactions are monitored.
Traumatic Brain Injury,"Headache, Memory problems, Cognitive impairment",Amantadine,Moderate,"Insomnia, Dizziness",Amantadine,"Amantadine aids in cognitive improvement after traumatic brain injury. Some dizziness, but improvements noticed."
Guillain-Barré Syndrome,"Muscle weakness, Tingling sensations, Paralysis",Intravenous Immunoglobulin (IVIG),High,"Headache, Fever",IVIG,"IVIG has been crucial in treating my Guillain-Barré Syndrome. Some side effects, but it aids in recovery."
Neuralgia,"Sharp, stabbing pain along nerves",Carbamazepine,High,"Dizziness, Drowsiness",Carbamazepine,"Carbamazepine effectively manages my neuralgia pain. Some dizziness, but the pain relief is worth it."
Trigeminal Neuralgia,"Severe facial pain, Electric shock-like sensations",Oxcarbazepine,High,"Drowsiness, Double vision",Oxcarbazepine,"Oxcarbazepine helps control my trigeminal neuralgia pain. Some drowsiness, but overall satisfied."
Central Pain Syndrome,"Chronic pain, Tingling sensations, Sensitivity to touch",Pregabalin,High,"Dizziness, Weight gain",Pregabalin,"Pregabalin has been effective in managing my central pain syndrome. Some dizziness, but the pain relief is worth it."
Dystonia,"Involuntary muscle contractions, Twisting movements",Botulinum Toxin Injections,High,"Muscle weakness, Neck pain",Botulinum Toxin,"Botulinum Toxin injections effectively alleviate my dystonia symptoms. Some muscle weakness, but it improves with time."
Narcolepsy,"Excessive daytime sleepiness, Cataplexy",Modafinil,High,"Insomnia, Nervousness",Modafinil,"Modafinil helps manage my narcolepsy symptoms. Some difficulty sleeping, but overall satisfied."
Sleep Apnea,"Loud snoring, Pauses in breathing during sleep",Continuous Positive Airway Pressure (CPAP),High,"Mask discomfort, Skin irritation",N/A,CPAP therapy effectively treats my sleep apnea. Mask discomfort is manageable for improved sleep quality.
Creutzfeldt-Jakob Disease,"Rapidly progressive dementia, Muscle stiffness",Supportive care,N/A,N/A,N/A,Supportive care is the primary approach for Creutzfeldt-Jakob Disease. Focus on comfort and quality of life.
Neurofibromatosis,"Tumors on nerves, Café-au-lait spots",Surgery,N/A,N/A,N/A,Surgery is often necessary to address neurofibromatosis tumors. Tailored treatment plans based on the extent of the condition.
Bell's Palsy,"Facial paralysis, Drooping of the mouth",Corticosteroids,High,"Insomnia, Increased appetite",Various,"Corticosteroids help in managing Bell's Palsy symptoms. Some side effects, but improvements noticed."
CNS Vasculitis,"Headache, Confusion, Seizures",Cyclophosphamide,High,"Nausea, Hair loss",Cyclophosphamide,"Cyclophosphamide is crucial in treating CNS vasculitis. Some side effects, but it aids in recovery from inflammation."
Prion Diseases,"Rapid neurological deterioration, Memory loss",No specific treatment,N/A,N/A,N/A,No specific treatment is available for prion diseases. Focus on supportive care and symptom management.
Essential Tremor,"Involuntary shaking, Tremors",Propranolol,Moderate,"Fatigue, Dizziness",Propranolol,"Propranolol helps in controlling essential tremor. Some fatigue, but it's a manageable side effect."
Spinocerebellar Ataxia,"Incoordination, Unsteady gait",Physical Therapy,N/A,N/A,N/A,Physical therapy plays a crucial role in managing spinocerebellar ataxia symptoms. Exercises for coordination improvement.
Autoimmune Encephalitis,"Cognitive decline, Seizures, Psychiatric symptoms",Intravenous Immunoglobulin (IVIG),Moderate,"Headache, Fever",IVIG,"IVIG is crucial in managing autoimmune encephalitis. Some side effects, but it aids in recovery from inflammation."
Vascular Dementia,"Memory loss, Cognitive decline, Difficulty concentrating",Donepezil,High,"Nausea, Insomnia",Donepezil,"Donepezil has been effective in managing my vascular dementia symptoms. Some initial discomfort, but improvements noticed."
Tourette Syndrome,"Involuntary tics, Repetitive movements",Haloperidol,Moderate,"Weight gain, Sedation",Haloperidol,"Haloperidol helps in managing tics associated with Tourette syndrome. Some sedation, but overall satisfied."
Neurocysticercosis,"Seizures, Headache, Cognitive impairment",Albendazole,Praziquantel,High,"Nausea, Abdominal pain",Albendazole Praziquantel Albendazole and Praziquantel combination effectively treats my neurocysticercosis. Some discomfort but worth it for the relief.
CADASIL,"Migraines, Stroke-like symptoms, Cognitive decline",Antiplatelet agents,High,"Bleeding risk, Upset stomach",Various,"Antiplatelet agents are crucial in managing CADASIL symptoms. Some stomach discomfort, but it's manageable."
CIDP,"Weakness, Numbness, Tingling in extremities",Intravenous Immunoglobulin (IVIG),Moderate,"Headache, Fatigue",IVIG,"IVIG helps manage my CIDP symptoms. Some side effects, but it aids in recovery from demyelination."
Wilson's Disease,"Liver problems, Neurological symptoms",Penicillamine,Moderate,"Rash, Fever",Penicillamine,"Penicillamine is effective in managing Wilson's disease. Some side effects, but necessary for copper chelation."
Restless Genital Syndrome,"Persistent genital arousal, Discomfort",Gabapentin,Moderate,"Drowsiness, Weight gain",Gabapentin,"Gabapentin helps manage restless genital syndrome symptoms. Some drowsiness, but the relief is worth it."
Progressive Supranuclear Palsy (PSP),"Balance problems, Gaze abnormalities, Personality changes",Levodopa,High,"Nausea, Hallucinations",Levodopa,Levodopa aids in managing symptoms of Progressive Supranuclear Palsy. Side effects are manageable.
Paraneoplastic Syndromes,Neurological symptoms associated with cancer,Immunotherapy,Moderate,"Flu-like symptoms, Fatigue",Various,"Immunotherapy is crucial in managing paraneoplastic syndromes. Some side effects, but it aids in targeting cancer-associated symptoms."
Trigeminal Autonomic Cephalalgias (TACs),"Severe headaches, Autonomic symptoms",Verapamil,High,"Constipation, Lowered blood pressure",Verapamil,"Verapamil effectively manages my trigeminal autonomic cephalalgias. Some side effects, but it's a relief from intense headaches."
Lewy Body Dementia,"Visual hallucinations, Fluctuating cognitive abilities",Rivastigmine,Moderate,"Nausea, Insomnia",Rivastigmine,"Rivastigmine has been effective in managing Lewy Body Dementia symptoms. Some initial discomfort, but improvements noticed."
Major Depressive Disorder,"Persistent sadness, Loss of interest, Fatigue",Sertraline,High,"Weight gain, Drowsiness",Sertraline,"Sertraline has been effective in managing my major depressive disorder. Some drowsiness, but it improves my mood."
Generalized Anxiety Disorder,"Excessive worrying, Restlessness",Escitalopram,Moderate,"Insomnia, Nausea",Escitalopram,"Escitalopram helps alleviate my generalized anxiety. Some initial discomfort, but improvements noticed."
Bipolar Disorder,"Mood swings, Energy fluctuations",Lithium,High,"Hand tremors, Increased thirst",Lithium,"Lithium effectively stabilizes my mood in bipolar disorder. Some side effects, but it's crucial for mood management."
Schizophrenia,"Hallucinations, Delusions, Disorganized thinking",Risperidone,Moderate,"Weight gain, Dizziness",Risperidone,"Risperidone helps manage my schizophrenia symptoms. Some dizziness, but overall satisfied."
Obsessive-Compulsive Disorder (OCD),"Intrusive thoughts, Compulsive behaviors",Fluoxetine,Moderate,"Insomnia, Nausea",Fluoxetine,"Fluoxetine aids in managing my OCD symptoms. Some initial discomfort, but improvements noticed."
Post-Traumatic Stress Disorder (PTSD),"Flashbacks, Nightmares, Hypervigilance",Venlafaxine,Moderate,"Increased blood pressure, Sweating",Venlafaxine,"Venlafaxine has been effective in managing my PTSD symptoms. Some side effects, but it's worth the relief."
Attention-Deficit/Hyperactivity Disorder (ADHD),"Inattention, Hyperactivity, Impulsivity",Methylphenidate,High,"Insomnia, Loss of appetite",Methylphenidate,"Methylphenidate helps manage my ADHD symptoms. Some loss of appetite, but it improves focus and attention."
Eating Disorders,"Disordered eating patterns, Body image concerns",Psychotherapy,N/A,N/A,N/A,Psychotherapy is crucial in treating eating disorders. Tailored approaches based on individual needs.
Panic Disorder,"Sudden, intense fear, Shortness of breath",Clonazepam,High,"Drowsiness, Memory issues",Clonazepam,"Clonazepam provides quick relief during panic attacks. Some memory issues, but it's crucial in managing panic disorder."
Social Anxiety Disorder,"Fear of social situations, Avoidance behaviors",Paroxetine,Moderate,"Weight gain, Fatigue",Paroxetine,"Paroxetine helps manage my social anxiety. Some fatigue, but overall satisfied with the medication."
Borderline Personality Disorder,"Impulsivity, Unstable relationships, Emotional instability",Dialectical Behavior Therapy (DBT),N/A,N/A,N/A,DBT is a crucial part of managing borderline personality disorder. Focus on skills for emotion regulation and interpersonal effectiveness.
Insomnia Disorder,"Difficulty falling asleep, Frequent waking during the night",Zolpidem,High,"Drowsiness, Dizziness",Zolpidem,"Zolpidem has been effective in managing my insomnia. Some drowsiness, but it improves my sleep quality."
Seasonal Affective Disorder (SAD),Depression during specific seasons,Light Therapy,N/A,N/A,N/A,Light therapy is effective in managing seasonal affective disorder. Exposure to bright light improves mood during the affected seasons.
Hoarding Disorder,"Excessive accumulation of possessions, Difficulty discarding items",Selective Serotonin Reuptake Inhibitors (SSRIs),Moderate,"Nausea, Insomnia",Various,"SSRIs are helpful in managing symptoms of hoarding disorder. Some side effects, but it aids in treatment."
Autism Spectrum Disorder,"Social difficulties, Repetitive behaviors",Applied Behavior Analysis (ABA),N/A,N/A,N/A,ABA therapy is crucial in managing autism spectrum disorder. Tailored interventions based on individual needs.
Body Dysmorphic Disorder,Obsession with perceived flaws in physical appearance,Clomipramine,Moderate,"Dry mouth, Constipation",Clomipramine,"Clomipramine aids in managing my body dysmorphic disorder. Some side effects, but it's crucial for symptom control."
Antisocial Personality Disorder,"Disregard for others' rights, Lack of empathy",Psychotherapy,N/A,N/A,N/A,Psychotherapy is crucial in managing antisocial personality disorder. Focus on developing empathy and behavioral changes.
Cyclothymic Disorder,"Mood swings, Mild depressive and hypomanic episodes",Lamotrigine,Moderate,"Dizziness, Blurred vision",Lamotrigine,"Lamotrigine helps in stabilizing mood in cyclothymic disorder. Some dizziness, but overall satisfied with the medication."
Selective Mutism,Consistent inability to speak in certain situations,Behavioral Therapy,N/A,N/A,N/A,Behavioral therapy is crucial in managing selective mutism. Focus on building communication skills in a supportive environment.
Trichotillomania,"Hair-pulling, Compulsive behavior",N-Acetylcysteine,Moderate,"Nausea, Upset stomach",N-Acetylcysteine,"N-Acetylcysteine has been effective in managing my trichotillomania. Some gastrointestinal discomfort, but improvements noticed."
Down Syndrome,"Intellectual disability, characteristic facial features, developmental delays",Supportive care,N/A,N/A,N/A,Supportive care focuses on managing symptoms associated with Down Syndrome.
Cystic Fibrosis,"Respiratory problems, Digestive issues, Salty skin",Ivacaftor,High,"Nausea, Headache",Ivacaftor,"Ivacaftor has been effective in managing cystic fibrosis symptoms. Some side effects, but it improves quality of life."
Huntington's Disease,"Involuntary movements, Cognitive decline, Mood changes",Tetrabenazine,Moderate,"Depression, Insomnia",Tetrabenazine,"Tetrabenazine helps in managing Huntington's disease symptoms. Some mood changes, but overall satisfied."
Sickle Cell Anemia,"Anemia, Fatigue, Painful crises",Hydroxyurea,High,"Nausea, Diarrhea",Hydroxyurea,"Hydroxyurea effectively reduces the frequency of painful crises in sickle cell anemia. Some gastrointestinal discomfort, but it's worth the relief."
Duchenne Muscular Dystrophy,"Muscle weakness, Progressive difficulty in walking",Prednisone,Moderate,"Weight gain, Mood swings",Prednisone,"Prednisone aids in managing Duchenne muscular dystrophy symptoms. Some side effects, but it improves muscle function."
Hemophilia,"Bleeding, Joint pain, Easy bruising",Factor VIII Replacement,High,"Allergic reactions, Inhibitor development",Factor VIII,Factor VIII replacement is crucial in managing hemophilia. Monitoring for inhibitor development is essential.
Turner Syndrome,"Short stature, Delayed puberty, Heart defects",Growth Hormone,High,"Headache, Swelling",Somatropin,"Growth hormone helps in addressing short stature in Turner syndrome. Some side effects, but it improves overall growth."
Klinefelter Syndrome,"Infertility, Reduced facial and body hair, Breast development",Testosterone Replacement,High,"Acne, Increased red blood cell count",Testosterone,"Testosterone replacement is effective in managing symptoms of Klinefelter syndrome. Some acne, but overall satisfied."
Fragile X Syndrome,"Intellectual disability, Behavioral challenges, Hyperactivity",Stimulant Medications,Moderate,"Insomnia, Loss of appetite",Various,"Stimulant medications help in managing hyperactivity in Fragile X syndrome. Some appetite changes, but it aids in behavior control."
Phenylketonuria (PKU),"Intellectual disability, Behavioral problems, Seizures",Low-Phenylalanine Diet,N/A,N/A,N/A,A low-phenylalanine diet is crucial in managing PKU. Dietary restrictions are essential for symptom control.
Tay-Sachs Disease,"Loss of motor skills, Intellectual disability, Cherry-red spot on the eyes",Supportive care,N/A,N/A,N/A,Supportive care focuses on managing symptoms associated with Tay-Sachs Disease.
Celiac Disease,"Digestive problems, Fatigue, Weight loss",Gluten-Free Diet,N/A,N/A,N/A,A gluten-free diet is crucial in managing celiac disease. Dietary restrictions are essential for symptom control.
Marfan Syndrome,"Tall stature, Long limbs, Heart problems",Beta-Blockers,High,"Dizziness, Fatigue",Various,"Beta-blockers help in managing heart problems associated with Marfan syndrome. Some side effects, but it aids in cardiovascular health."
Williams Syndrome,"Cardiovascular issues, Unique facial features, Learning difficulties",Calcium Channel Blockers,High,"Upset stomach, Drowsiness",Various,"Calcium channel blockers help manage cardiovascular issues in Williams syndrome. Some drowsiness, but overall satisfied."
Neurofibromatosis,"Tumors on nerves, Café-au-lait spots",Surgery,N/A,N/A,N/A,Surgery is often necessary to address neurofibromatosis tumors. Tailored treatment plans based on the extent of the condition.
Muscular Dystrophy,"Progressive muscle weakness, Difficulty walking",Physical Therapy,N/A,N/A,N/A,Physical therapy plays a crucial role in managing muscular dystrophy. Exercises for muscle strength and flexibility.
Prader-Willi Syndrome,"Feeding difficulties, Obesity, Intellectual disability",Growth Hormone,High,"Headache, Swelling",Somatropin,"Growth hormone helps in addressing growth and weight issues in Prader-Willi syndrome. Some side effects, but overall satisfied."
Angelman Syndrome,"Developmental delays, Seizures, Happy demeanor",Antiepileptic Medications,Moderate,"Drowsiness, Tremors",Various,"Antiepileptic medications help in managing seizures associated with Angelman syndrome. Some side effects, but overall improvements noticed."
Hereditary Hemochromatosis,"Excessive iron absorption, Joint pain, Fatigue",Therapeutic Phlebotomy,High,"Low blood pressure, Dizziness",N/A,"Therapeutic phlebotomy is crucial in managing iron overload in hereditary hemochromatosis. Some side effects, but it aids in reducing iron levels."
Polycystic Kidney Disease,"Kidney cysts, High blood pressure, Abdominal pain",Angiotensin-Converting Enzyme (ACE) Inhibitors,Moderate,"Cough, Elevated potassium levels",Various,"ACE inhibitors help in managing blood pressure and kidney function in polycystic kidney disease. Some side effects, but overall improvements noticed."
Tuberous Sclerosis Complex,"Seizures, Intellectual disability, Skin lesions",,,,,
Achondroplasia,"Short stature, Short limbs, Large head",Growth Hormone,High,"Headache, Swelling",Somatropin,"Growth hormone effectively addresses short stature in achondroplasia. Some side effects, but it improves overall growth."
Bruton Agammaglobulinemia,"Recurrent infections, Low levels of immunoglobulins",Immunoglobulin Replacement,High,"Fever, Chills",Immunoglobulin,"Immunoglobulin replacement is crucial in managing agammaglobulinemia. Some side effects, but it helps prevent infections."
Hemochromatosis,"Excessive iron absorption, Joint pain, Fatigue",Phlebotomy,High,"Dizziness, Anemia",N/A,"Phlebotomy effectively reduces iron levels in hemochromatosis. Some side effects, but it aids in preventing complications."
Lynch Syndrome,Increased risk of colorectal and other cancers,Surveillance and Surgery,N/A,N/A,N/A,Regular surveillance and preventive surgeries are crucial in managing cancer risk in Lynch syndrome.
Myotonic Dystrophy,"Muscle weakness, Myotonia, Intellectual impairment",Mexiletine,Moderate,"Nausea, Dizziness",Mexiletine,"Mexiletine helps manage myotonia in myotonic dystrophy. Some side effects, but it improves muscle function."
Osteogenesis Imperfecta,"Brittle bones, Bone deformities, Hearing loss",Bisphosphonates,High,"Gastrointestinal upset, Bone pain",Various,"Bisphosphonates aid in strengthening bones in osteogenesis imperfecta. Some discomfort, but it reduces fracture risk."
Pancreatitis,"Abdominal pain, Nausea, Vomiting",Pancreatic Enzyme Replacement,High,"Diarrhea, Abdominal cramps",Various,"Pancreatic enzyme replacement is crucial in managing pancreatic insufficiency in pancreatitis. Some digestive discomfort, but it aids in nutrient absorption."
Turner Syndrome,"Short stature, Delayed puberty, Heart defects",Estrogen Replacement,High,"Headache, Breast tenderness",Various,"Estrogen replacement helps in addressing delayed puberty in Turner syndrome. Some side effects, but it aids in development."
Xeroderma Pigmentosum,"Extreme sensitivity to UV rays, Skin cancers",Sun Protection Measures,N/A,N/A,N/A,"Strict sun protection measures are essential in managing xeroderma pigmentosum. Sunscreen, clothing, and sunglasses are crucial."
Familial Adenomatous Polyposis,"Colon polyps, Increased risk of colorectal cancer",Colectomy and Surveillance,N/A,N/A,N/A,Colectomy and regular surveillance are crucial in managing the risk of colorectal cancer in familial adenomatous polyposis.
Achondrogenesis,"Severe short stature, Limb abnormalities",Supportive care,N/A,N/A,N/A,Supportive care focuses on managing symptoms associated with achondrogenesis. Regular monitoring for complications is essential.
Craniosynostosis,"Premature fusion of skull bones, Abnormal head shape",Surgery,N/A,N/A,N/A,Surgery is often necessary to correct skull bone fusion in craniosynostosis. Individualized treatment plans based on the extent of the condition.
Gaucher Disease,"Enlarged liver and spleen, Bone pain, Anemia",Enzyme Replacement Therapy,High,"Infusion reactions, Fatigue",Various,"Enzyme replacement therapy effectively manages Gaucher disease symptoms. Some side effects, but it improves quality of life."
Fragile X-Associated Tremor/Ataxia Syndrome (FXTAS),"Tremors, Ataxia, Cognitive decline",Physical Therapy,Moderate,"Fatigue, Muscle soreness",Various,Physical therapy plays a crucial role in managing FXTAS symptoms. Exercises for coordination and strength.
Hereditary Angioedema,"Swelling attacks, Abdominal pain",C1 Esterase Inhibitor Replacement,High,"Headache, Nausea",Various,"C1 esterase inhibitor replacement is crucial during hereditary angioedema attacks. Some side effects, but it reduces swelling."
Huntington's Disease-Like 2 (HDL2),"Movement abnormalities, Cognitive decline",Supportive care,N/A,N/A,N/A,Supportive care focuses on managing symptoms associated with Huntington's Disease-Like 2. Regular monitoring for complications is essential.
