Condition,Symptoms,Medicine,Effectiveness,Side_Effects,Salts,Public_Review
Trichomoniasis,"Itching, Burning sensation, Vaginal discharge",Metronidazole,High,"Metallic taste, Nausea",Metronidazole,"Metronidazole effectively treats trichomoniasis. Some side effects, but they are temporary compared to the relief it provides."
Leishmaniasis,"Skin sores, Fever, Weight loss","Sodium stibogluconate, Miltefosine",High,"Nausea, Muscle pain","Sodium stibogluconate, Miltefosine",Treatment for leishmaniasis with sodium stibogluconate and miltefosine has been effective. Side effects are temporary compared to the benefits.
Schistosomiasis,"Abdominal pain, Blood in urine, Fatigue",Praziquantel,High,"Headache, Dizziness",Praziquantel,"Praziquantel is effective against schistosomiasis. Some side effects, but they aid in eliminating the parasites."
Filariasis,"Swelling of limbs, Fever, Painful lumps",Diethylcarbamazine (DEC),High,"Nausea, Headache",Diethylcarbamazine,"Diethylcarbamazine is crucial for treating filariasis. Some side effects, but they are necessary for eliminating the parasites."
Cysticercosis,"Headache, Seizures, Cognitive impairment","Albendazole, Praziquantel",High,"Nausea, Dizziness","Albendazole, Praziquantel","Albendazole and praziquantel are essential for treating cysticercosis. Some side effects, but they are necessary for eliminating the parasites."
Amebiasis,"Abdominal pain, Diarrhea, Bloody stools",Metronidazole,High,"Metallic taste, Nausea",Metronidazole,"Metronidazole effectively treats amebiasis. Some side effects, but they are temporary compared to the relief it provides."
Kidney Stones,"Severe pain in the back or side, Blood in urine, Frequent urination","Pain relievers, Alpha blockers",High,"Nausea, Dizziness",Varies,"Pain relievers and alpha blockers have effectively managed my kidney stones. Some side effects, but they provide relief during episodes."
Gallstones,"Abdominal pain, Jaundice, Nausea","Cholecystectomy (surgery), Ursodeoxycholic acid",High,"Temporary diarrhea, Upset stomach",Varies,"Cholecystectomy and ursodeoxycholic acid have effectively treated my gallstones. Surgery is effective, and medications help dissolve smaller stones."
Ovarian Cysts,"Pelvic pain, Bloating, Irregular menstruation","Oral contraceptives, Laparoscopic cystectomy",High,"Nausea, Headache",Varies,"Oral contraceptives and laparoscopic cystectomy have effectively managed my ovarian cysts. Some side effects, but they are manageable."
Pancreatic Cysts,"Abdominal pain, Nausea, Vomiting","Monitoring, Drainage if necessary",N/A,N/A,N/A,"Monitoring and drainage when necessary have been effective for managing my pancreatic cysts. No specific medicine, but necessary interventions as needed."
Thyroid Nodules,"Neck swelling, Difficulty swallowing, Hoarseness","Levothyroxine, Radioactive iodine therapy",Varies,Varies,Levothyroxine,"Levothyroxine and radioactive iodine therapy have been effective for managing my thyroid nodules. Some side effects, but the benefits are crucial for thyroid function."
Breast Cysts,"Breast lumps, Tenderness, Changes in size","Fine needle aspiration, Monitoring",N/A,N/A,N/A,"Fine needle aspiration and monitoring have been effective for managing my breast cysts. No specific medicine, but regular check-ups are essential."
Liver Cysts,"Abdominal pain, Bloating, Difficulty breathing",Surgical removal if necessary,N/A,N/A,N/A,"Surgical removal when necessary has effectively treated my liver cysts. No specific medicine, but necessary intervention as needed."
Dermoid Cysts,"Pelvic pain, Lower abdominal swelling, Irregular menstruation",Surgical removal,N/A,N/A,N/A,"Surgical removal has effectively treated my dermoid cysts. No specific medicine, but necessary intervention for complete removal."
Pilonidal Cysts,"Pain at the base of the spine, Redness, Drainage of pus","Incision and drainage, Antibiotics if infected",Varies,Varies,Varies,"Incision and drainage, along with antibiotics if infected, have been effective for managing my pilonidal cysts. Some side effects, but they aid in recovery."
Sebaceous Cysts,"Round, painless lumps under the skin","Incision and drainage, Excision if necessary",Varies,Varies,Varies,"Incision and drainage, and excision if necessary, have effectively managed my sebaceous cysts. Some side effects, but they aid in recovery."
Herniated Disc,"Back pain, Leg pain, Numbness or tingling","Physical therapy, NSAIDs (e.g., Ibuprofen)",Moderate,"Upset stomach, Dizziness",Ibuprofen,"Physical therapy combined with NSAIDs has been moderately effective in managing my herniated disc. Some side effects, but the relief is noticeable."
Scoliosis,"Spinal curvature, Uneven shoulders, Back pain","Bracing, Physical therapy",Moderate,"Skin irritation, Mild discomfort",Varies,"Bracing and physical therapy have been moderately effective in managing my scoliosis. Some side effects, but they contribute to maintaining spinal alignment."
Spinal Stenosis,"Back pain, Numbness or weakness, Difficulty walking","Pain relievers, Physical therapy",Moderate,"Nausea, Dizziness",Varies,"Pain relievers and physical therapy have been moderately effective in managing my spinal stenosis. Some side effects, but they provide relief during episodes."
Osteoporosis of the Spine,"Loss of height, Back pain, Fractures","Bisphosphonates (e.g., Alendronate)",High,"Upset stomach, Joint pain",Alendronate,"Alendronate has been highly effective in managing my osteoporosis of the spine. Some side effects, but the benefits in bone health are crucial."
Kyphosis,"Forward curvature of the spine, Hunched back, Back pain","Physical therapy, Bracing",Moderate,"Mild discomfort, Skin irritation",Varies,"Physical therapy and bracing have been moderately effective in managing my kyphosis. Some side effects, but they contribute to maintaining spinal alignment."
Spinal Cord Injury,"Loss of sensation, Paralysis, Difficulty breathing",No specific medicine (rehabilitation),N/A,N/A,N/A,"Rehabilitation is essential for managing spinal cord injuries. No specific medicine, but interventions focus on maximizing functional recovery."
Ankylosing Spondylitis,"Stiffness, Pain in the lower back, Reduced flexibility","TNF inhibitors (e.g., Adalimumab)",High,"Injection site reactions, Headache",Adalimumab,"TNF inhibitors, such as adalimumab, have been highly effective in managing my ankylosing spondylitis. Some side effects, but the improvement in symptoms is significant."
Degenerative Disc Disease,"Back pain, Stiffness, Radiating pain","Pain relievers, Physical therapy",Moderate,"Nausea, Dizziness",Varies,"Pain relievers and physical therapy have been moderately effective in managing my degenerative disc disease. Some side effects, but they provide relief during episodes."
Spinal Tumors,"Back pain, Neurological deficits, Difficulty walking","Surgery, Radiation therapy, Chemotherapy",Varies,Varies,Varies,"Treatment for spinal tumors involves surgery, radiation therapy, and chemotherapy. No specific medicine, but interventions focus on tumor removal and management."
Spinal Fractures,"Back pain, Limited mobility, Difficulty standing","Bracing, Pain relievers",Moderate,"Nausea, Dizziness",Varies,"Bracing and pain relievers have been moderately effective in managing my spinal fractures. Some side effects, but they contribute to pain relief and healing."
Quadriplegia,"Paralysis of all four limbs, Impaired torso and pelvic organs","Physical therapy, Assistive devices",Moderate,Varies,Varies,"Physical therapy and assistive devices have been moderately effective in managing my quadriplegia. Some limitations, but they contribute to maintaining functionality."
Paraplegia,"Paralysis of the lower limbs, Impaired trunk and pelvic organs","Physical therapy, Assistive devices",Moderate,Varies,Varies,"Physical therapy and assistive devices have been moderately effective in managing my paraplegia. Some limitations, but they contribute to maintaining functionality."
Hemiplegia,"Paralysis of one side of the body, Impaired arm and leg function","Rehabilitation, Medications for underlying causes",Moderate,Varies,Varies,"Rehabilitation and medications for underlying causes have been moderately effective in managing my hemiplegia. Some limitations, but they contribute to maintaining functionality."
Diplegia,Paralysis affecting corresponding parts on both sides of the body,"Physical therapy, Assistive devices",Moderate,Varies,Varies,"Physical therapy and assistive devices have been moderately effective in managing my diplegia. Some limitations, but they contribute to maintaining functionality."
Monoplegia,Paralysis of a single limb or body part,"Physical therapy, Assistive devices",Moderate,Varies,Varies,"Physical therapy and assistive devices have been moderately effective in managing my monoplegia. Some limitations, but they contribute to maintaining functionality."
Locked-In Syndrome,"Paralysis of voluntary muscles, Except for eye movement","Supportive care, Communication devices",N/A,N/A,N/A,"Supportive care and communication devices are essential for managing Locked-In Syndrome. No specific medicine, but interventions focus on comfort and communication."
Conversion Disorder (Functional Neurological Symptom Disorder),Temporary paralysis or weakness without apparent physical cause,"Psychotherapy, Physical therapy",Varies,Varies,Varies,Psychotherapy and physical therapy have variable effectiveness in managing conversion disorder. Outcomes depend on individual response to treatment.
Guillain-Barré Syndrome,"Weakness, Paralysis starting from the legs and progressing upward","Intravenous immunoglobulin (IVIG), Plasma exchange",High,"Headache, Fatigue",IVIG,"IVIG and plasma exchange have been highly effective in managing Guillain-Barré Syndrome. Some side effects, but they are necessary for recovery."
Bell's Palsy,"Facial paralysis, Drooping on one side of the face","Corticosteroids, Physical therapy",High,"Upset stomach, Increased appetite",Corticosteroids,"Corticosteroids and physical therapy have been highly effective in managing Bell's Palsy. Some side effects, but the improvement in facial function is significant."
Cerebral Palsy,"Impaired muscle coordination, Difficulty in movement","Physical therapy, Assistive devices",Moderate,Varies,Varies,"Physical therapy and assistive devices have been moderately effective in managing cerebral palsy. Some limitations, but they contribute to maintaining functionality."