Condition,Symptoms,Medicine,Effectiveness,Side_Effects,Salts,Public_Review
Jarcho-Levin Syndrome,"Rib and spine abnormalities, Short stature",Surgery,N/A,N/A,N/A,Surgery is often necessary to address rib and spine abnormalities in Jarcho-Levin Syndrome. Individualized treatment plans based on the extent of the condition.
Limb-Girdle Muscular Dystrophy,Muscle weakness in shoulder and hip areas,Physical Therapy,Moderate,"Fatigue, Joint pain",Various,Physical therapy plays a crucial role in managing limb-girdle muscular dystrophy. Exercises for muscle strength and flexibility.
Mucopolysaccharidosis (MPS),"Skeletal abnormalities, Enlarged organs, Intellectual disability",Enzyme Replacement Therapy,High,"Infusion reactions, Headache",Various,"Enzyme replacement therapy effectively manages MPS symptoms. Some side effects, but it improves quality of life."
Polycystic Liver Disease,"Liver cysts, Abdominal pain",Symptomatic Treatment,N/A,N/A,N/A,Symptomatic treatment focuses on managing abdominal pain associated with polycystic liver disease. Regular monitoring for complications is essential.
Pompe Disease,"Muscle weakness, Respiratory difficulties",Enzyme Replacement Therapy,High,"Infusion reactions, Fatigue",Various,"Enzyme replacement therapy effectively manages Pompe disease symptoms. Some side effects, but it improves quality of life."
Spondyloepiphyseal Dysplasia,"Short stature, Joint pain, Lumbar lordosis",Symptomatic Treatment,N/A,N/A,N/A,Symptomatic treatment focuses on managing symptoms associated with spondyloepiphyseal dysplasia. Regular monitoring for complications is essential.
Treacher Collins Syndrome,"Facial abnormalities, Hearing loss",Surgery,N/A,N/A,N/A,Surgery is often necessary to address facial abnormalities in Treacher Collins Syndrome. Individualized treatment plans based on the extent of the condition.
Usher Syndrome,"Hearing loss, Vision loss",Hearing Aids and Assistive Devices,N/A,N/A,N/A,Hearing aids and assistive devices are crucial in managing hearing loss associated with Usher syndrome. Regular monitoring for vision loss is essential.
von Hippel-Lindau (VHL) Disease,"Tumors in various organs, Cysts",Surgery,N/A,N/A,N/A,Surgery is often necessary to address tumors and cysts in von Hippel-Lindau disease. Individualized treatment plans based on the extent of the condition.
Waardenburg Syndrome,"Hearing loss, Pigmentary changes in hair, Skin, and eyes",Symptomatic Treatment,N/A,N/A,N/A,Symptomatic treatment focuses on managing symptoms associated with Waardenburg syndrome. Regular monitoring for complications is essential.
Malaria,"Fever, Chills, Headache",Artemisinin-based Combination Therapies (ACTs),High,"Nausea, Vomiting",Artemisinin,"ACTs are highly effective in treating malaria. Some gastrointestinal discomfort, but the treatment is crucial in eliminating the infection."
Dengue Fever,"Fever, Severe headache, Joint and muscle pain",Supportive care,Moderate,Pain relievers for symptoms relief,N/A,"Supportive care helps manage dengue symptoms. Pain relievers provide relief, but complete recovery may take time."
Chagas Disease,"Swelling at the infection site, Fever, Fatigue",Benznidazole,High,"Nausea, Allergic reactions",Benznidazole,"Benznidazole effectively treats Chagas disease. Some side effects, but it's crucial for eliminating the parasite."
Leishmaniasis,"Skin sores, Fever, Enlarged spleen and liver",Miltefosine,High,"Nausea, Diarrhea",Miltefosine,"Miltefosine is effective in treating leishmaniasis. Some gastrointestinal discomfort, but it aids in recovery."
Schistosomiasis,"Abdominal pain, Diarrhea, Blood in urine",Praziquantel,High,"Headache, Dizziness",Praziquantel,"Praziquantel effectively treats schistosomiasis. Some mild side effects, but it's crucial for eliminating the parasite."
Lymphatic Filariasis,"Swelling in limbs, Fever, Lymphedema",Ivermectin and Albendazole,Moderate,"Dizziness, Fatigue","Ivermectin, Albendazole","Ivermectin and Albendazole combination helps manage lymphatic filariasis. Some side effects, but it aids in symptom relief."
Onchocerciasis (River Blindness),"Itchy skin, Visual impairment",Ivermectin,High,"Dizziness, Fatigue",Ivermectin,"Ivermectin effectively treats onchocerciasis. Some side effects, but it's crucial for preventing blindness."
Trachoma,"Eye discharge, Itching, Blurred vision",Azithromycin,High,"Nausea, Diarrhea",Azithromycin,"Azithromycin is effective in treating trachoma. Some gastrointestinal discomfort, but it aids in eliminating the bacteria."
Buruli Ulcer,"Skin ulcers, Swelling, Nodules",Rifampicin and Clarithromycin,High,"Nausea, Joint pain","Rifampicin, Clarithromycin","Rifampicin and Clarithromycin combination effectively treats Buruli ulcer. Some side effects, but it aids in healing."
Yaws,"Skin sores, Joint pain, Swelling",Single-dose Azithromycin,High,"Nausea, Diarrhea",Azithromycin,"Single-dose Azithromycin is effective in treating yaws. Some gastrointestinal discomfort, but it aids in eliminating the bacteria."
African Trypanosomiasis (Sleeping Sickness),"Fever, Headache, Joint pain",Suramin and Eflornithine,High,"Nausea, Anemia","Suramin, Eflornithine","Suramin and Eflornithine combination effectively treats sleeping sickness. Some side effects, but it's crucial for eliminating the parasite."
Iron Deficiency Anemia,"Fatigue, Pale skin, Weakness","Iron, Vitamin C for better iron absorption",High,"Constipation, Nausea","Iron, Vitamin C",Iron supplements have significantly improved my energy levels. Ensure a balanced diet for long-term prevention.
Vitamin D Deficiency,"Bone pain, Muscle weakness, Fatigue","Vitamin D, Calcium",Moderate,"Nausea, Weakness","Vitamin D, Calcium",Vitamin D supplements have been effective in alleviating my symptoms. Don't forget sunlight exposure for natural synthesis.
Beriberi,"Fatigue, Weakness, Swelling",Thiamine (Vitamin B1),High,"Allergic reactions, Itching",Thiamine (Vitamin B1),Thiamine supplements have helped restore my energy. Be mindful of alcohol intake for prevention.
Scurvy,"Fatigue, Joint pain, Bleeding gums",Vitamin C,High,"Diarrhea, Nausea",Vitamin C,Increased intake of fruits rich in vitamin C has improved my symptoms. A diverse diet is key to prevention.
Rickets,"Soft bones, Delayed growth, Muscle weakness","Vitamin D, Calcium, Phosphorus",High,"Constipation, Nausea","Vitamin D, Calcium, Phosphorus",Vitamin D and calcium supplements have strengthened my bones. Sun exposure and a balanced diet are crucial for prevention.
Kwashiorkor,"Edema (swelling), Malnutrition, Skin changes","Protein, Essential amino acids",Moderate,"Digestive upset, Allergic reactions","Protein, Essential amino acids",Protein-rich diet and nutritional rehabilitation have helped in my recovery. Ensure adequate protein in daily meals for prevention.
Night Blindness,"Difficulty seeing in low light, Blindness at night",Vitamin A,High,"Headache, Nausea",Vitamin A,Vitamin A supplements have improved my night vision. Eating a variety of colorful vegetables supports long-term prevention.
Pellagra,"Skin rash, Diarrhea, Cognitive impairment","Niacin (Vitamin B3), Tryptophan",Moderate,"Liver toxicity, Nausea","Niacin (Vitamin B3), Tryptophan",Niacin supplements have relieved my symptoms. A diverse diet ensures sufficient niacin intake for prevention.
Osteomalacia,"Bone pain, Muscle weakness, Deformities","Vitamin D, Calcium, Phosphorus",High,"Constipation, Nausea","Vitamin D, Calcium, Phosphorus",Vitamin D and calcium supplements have strengthened my bones. Adequate sunlight and a balanced diet are essential for prevention.
Goiter,"Swelling in the neck, Difficulty swallowing or breathing",Iodine,Moderate,"Thyroid dysfunction, Allergic reactions",Iodine,Iodine supplements have reduced the swelling. Use iodized salt and include iodine-rich foods for prevention.
Cholera,"Watery diarrhea, Vomiting, Dehydration",Oral rehydration solution (ORS),High,None,Electrolytes,ORS has been a lifesaver during cholera. Rapidly resolves dehydration without significant side effects.
Giardiasis,"Diarrhea, Abdominal cramps, Nausea",Metronidazole,High,"Metallic taste, Nausea",Metronidazole,"Metronidazole effectively clears Giardia infections. Some minor side effects, but overall a reliable treatment."
Cryptosporidiosis,"Watery diarrhea, Stomach cramps, Fever",Nitazoxanide,Moderate,"Headache, Abdominal pain",Nitazoxanide,"Nitazoxanide helps in treating cryptosporidiosis. Some side effects, but generally well-tolerated."
Legionnaires' Disease,"Cough, Shortness of breath, Chest pain",Azithromycin,High,"Nausea, Upset stomach",Azithromycin,"Azithromycin is effective in treating Legionnaires' disease. Some gastrointestinal discomfort, but it aids in recovery."
Leptospirosis,"Fever, Muscle aches, Jaundice",Doxycycline,High,"Nausea, Photosensitivity",Doxycycline,"Doxycycline is effective against leptospirosis. Some side effects, but it's crucial for eliminating the bacteria."
Norovirus Infection,"Nausea, Vomiting, Diarrhea",Supportive care,Moderate,None,N/A,"Supportive care helps manage norovirus symptoms. No specific medicine, focus on rehydration and rest."
Amoebiasis,"Abdominal pain, Diarrhea, Bloody stools",Metronidazole,High,"Metallic taste, Nausea",Metronidazole,"Metronidazole effectively treats amoebiasis. Some minor side effects, but it's crucial for eliminating the parasite."
Typhoid Fever,"Fever, Headache, Rose-colored spots,fatigue,Vomiting",Ciprofloxacin,High,"Nausea, Diarrhea",Ciprofloxacin,"Ciprofloxacin is effective against typhoid fever. Some gastrointestinal discomfort, but it aids in recovery."
Campylobacteriosis,"Diarrhea, Abdominal cramps, Fever",Azithromycin,High,"Nausea, Upset stomach",Azithromycin,"Azithromycin is effective in treating campylobacteriosis. Some gastrointestinal discomfort, but it aids in recovery."
Hepatitis A,"Fatigue, Jaundice, Abdominal pain",Hepatitis A vaccine,Very High,None,N/A,"Hepatitis A vaccine is highly effective in preventing infection. No significant side effects, a crucial preventive measure."
Rotavirus Infection,"Severe diarrhea, Vomiting, Dehydration",Rotavirus vaccine,Very High,None,N/A,"Rotavirus vaccine is highly effective in preventing severe gastroenteritis caused by Rotavirus. No notable side effects, a crucial immunization for infants."
Shigellosis,"Diarrhea, Fever, Abdominal cramps",Ciprofloxacin,High,"Nausea, Headache",Ciprofloxacin,"Ciprofloxacin is effective against Shigella infections. Some side effects, but it aids in recovery."
Cyclosporiasis,"Watery diarrhea, Fatigue, Weight loss",Trimethoprim-sulfamethoxazole,High,"Nausea, Vomiting","Trimethoprim, Sulfamethoxazole","Trimethoprim-sulfamethoxazole effectively treats cyclosporiasis. Some side effects, but it's crucial for eliminating the parasite."
Hantavirus Pulmonary Syndrome,"Fever, Muscle aches, Shortness of breath",Supportive care,Moderate,None,N/A,"Supportive care is crucial for managing Hantavirus Pulmonary Syndrome. No specific medicine, focus on symptomatic relief."
Waterborne Typhus (Murine Typhus),"Fever, Rash, Headache",Doxycycline,High,"Nausea, Photosensitivity",Doxycycline,"Doxycycline is effective against waterborne typhus. Some side effects, but it's crucial for eliminating the bacteria."
Amebic Meningoencephalitis,"Headache, Fever, Stiff neck",Amphotericin B,High,"Chills, Fever",Amphotericin B,"Amphotericin B is effective in treating amebic meningoencephalitis. Some side effects, but it aids in recovery."
Hepatitis E,"Jaundice, Abdominal pain, Dark urine",Ribavirin,Moderate,"Fatigue, Nausea",Ribavirin,"Ribavirin is used in severe cases of Hepatitis E. Some side effects, but it aids in recovery."
Ciguatera Poisoning,"Nausea, Vomiting, Diarrhea",Supportive care,Moderate,None,N/A,"Supportive care helps manage symptoms of ciguatera poisoning. No specific medicine, focus on symptomatic relief."
Naegleriasis (Brain-Eating Amoeba),"Fever, Headache, Nausea",Amphotericin B,High,"Chills, Fever",Amphotericin B,"Amphotericin B is effective in treating Naegleriasis. Some side effects, but it's crucial for eliminating the amoeba."
E. coli Infection,"Diarrhea, Abdominal cramps, Fever",Supportive care,Moderate,None,N/A,"Supportive care helps manage E. coli infection. No specific medicine, focus on rehydration and rest."
Arachnophobia,Intense fear of spiders,Exposure Therapy,High,None,N/A,"Exposure therapy has been highly effective in overcoming my arachnophobia. No side effects, a life-changing treatment."
Acrophobia,Intense fear of heights,Cognitive Behavioral Therapy (CBT),High,None,N/A,"CBT has significantly reduced my fear of heights. No medication needed, and the benefits are long-lasting."
Claustrophobia,Intense fear of confined spaces,"Anti-anxiety medications (e.g., benzodiazepines)",Moderate,"Drowsiness, Dizziness",Varies,"Medication helps manage my claustrophobia symptoms, but side effects can be bothersome."
Agoraphobia,Fear of places or situations that may cause panic or embarrassment,Selective Serotonin Reuptake Inhibitors (SSRIs),High,"Nausea, Insomnia",Varies,"SSRIs have helped in managing my agoraphobia. Some side effects, but the benefits outweigh them."
Ophidiophobia,Intense fear of snakes,Systematic Desensitization Therapy,High,None,N/A,"Desensitization therapy effectively reduced my fear of snakes. No medication needed, and the results are lasting."
Social Anxiety Disorder (Social Phobia),Fear of social situations and interactions,"Cognitive Behavioral Therapy (CBT), Selective Serotonin Reuptake Inhibitors (SSRIs)",High,"Drowsiness, Nausea",Varies,"CBT and SSRIs have been effective in managing my social anxiety. Some side effects, but the improvement is noticeable."
Xenophobia,Fear or aversion towards people from other countries or cultures,"Counseling, Exposure Therapy",Moderate,None,N/A,"Counseling and exposure therapy have helped me address my xenophobia. Minimal side effects, and I feel more open-minded."
Aerophobia,Intense fear of flying,"Gradual Exposure Therapy, Anti-anxiety medications",High,"Drowsiness, Dizziness",Varies,Exposure therapy and anti-anxiety medications have made flying less daunting for me. The occasional side effects are worth the overall improvement.
Hemophobia,Intense fear of blood,Desensitization Therapy,High,None,N/A,"Desensitization therapy has successfully reduced my fear of blood. No medication needed, and I feel more comfortable in medical settings."
Glossophobia,Fear of public speaking,"Public Speaking Training, Beta-Blockers",High,"Fatigue, Dizziness",Varies,Training and occasional use of beta-blockers have made public speaking more manageable. Side effects are minor compared to the anxiety relief.
Nyctophobia,Intense fear of the dark or night,Exposure Therapy,High,None,N/A,"Exposure therapy has been highly effective in overcoming my fear of the dark. No side effects, and I feel more at ease in nighttime situations."
Erythrophobia,Intense fear of blushing or the color red,Cognitive Behavioral Therapy (CBT),High,None,N/A,"CBT has been remarkably effective in managing my fear of blushing. No need for medication, and the results are long-lasting."
Ailurophobia,Intense fear of cats,Gradual Exposure Therapy,High,None,N/A,"Exposure therapy has significantly reduced my fear of cats. No medication needed, and I can now comfortably be around them."
Nomophobia,Fear of being without a mobile phone or losing network connectivity,"Behavioral Therapy, Mindfulness",Moderate,"Anxiety, Restlessness",Varies,"Therapy and mindfulness techniques have helped me cope with nomophobia. Some side effects, but the overall impact is positive."
Pogonophobia,Fear of beards,Desensitization Therapy,High,None,N/A,"Desensitization therapy has successfully addressed my fear of beards. No medication needed, and I feel more at ease in the presence of bearded individuals."
Triskaidekaphobia,Fear of the number 13,Cognitive Behavioral Therapy (CBT),High,None,N/A,"CBT has effectively reduced my fear of the number 13. No need for medication, and I can now approach this number without anxiety."
Venustraphobia,Fear of beautiful women,"Exposure Therapy, Cognitive Restructuring",High,None,N/A,"Therapy techniques have helped me overcome my fear of beautiful women. No medication needed, and I appreciate beauty without anxiety."
Dentophobia,Fear of dentists or dental procedures,"Relaxation Techniques, Sedation Dentistry",High,"Drowsiness, Fatigue",Varies,"Relaxation techniques and sedation dentistry have made dental visits less daunting. Some side effects, but the benefits are significant."
Gephyrophobia,Fear of bridges,Gradual Exposure Therapy,High,None,N/A,"Exposure therapy has successfully reduced my fear of bridges. No medication needed, and I now navigate them with more confidence."
Zoophobia,General fear of animals,"Counseling, Desensitization Therapy",Moderate,None,N/A,"Counseling and desensitization therapy have helped me manage my general fear of animals. No medication needed, and I feel more comfortable around pets."
Turophobia,Fear of cheese,Cognitive Behavioral Therapy (CBT),High,None,N/A,"CBT has effectively addressed my fear of cheese. No medication needed, and I can now enjoy a variety of dishes without anxiety."
Chronomentrophobia,Fear of clocks or time,Cognitive Behavioral Therapy (CBT),High,None,N/A,"CBT has significantly reduced my fear of clocks. No need for medication, and I now handle time-related situations more comfortably."
Ascariasis,"Abdominal pain, Vomiting, Worms in stool",Albendazole,High,"Nausea, Headache",Albendazole,"Albendazole effectively eliminates Ascariasis. Some side effects, but it's crucial for eradicating the worms."
Trichuriasis,"Abdominal pain, Diarrhea, Anemia",Mebendazole,High,"Dizziness, Fatigue",Mebendazole,"Mebendazole is effective in treating Trichuriasis. Some side effects, but it aids in eliminating the worms."
Hookworm Infection,"Itching, Rash, Abdominal pain",Pyrantel Pamoate,High,"Nausea, Dizziness",Pyrantel Pamoate,"Pyrantel Pamoate effectively treats Hookworm Infection. Some side effects, but it's crucial for eliminating the worms."
Pinworm Infection,"Itching around the anus, Insomnia, Irritability",Mebendazole,High,"Nausea, Dizziness",Mebendazole,"Mebendazole is effective against Pinworm Infection. Some side effects, but it aids in eliminating the worms."
Filariasis,"Swelling of limbs, Fever, Painful lumps",Diethylcarbamazine (DEC),High,"Nausea, Headache",Diethylcarbamazine,"Diethylcarbamazine is crucial for treating Filariasis. Some side effects, but it's necessary for eliminating the worms."
Guinea Worm Disease,"Painful skin blister, Worm emerging from the blister",No specific medicine,N/A,N/A,N/A,"No specific medicine is available, but prevention measures are crucial to avoid Guinea Worm Disease."
Tapeworm Infection,"Abdominal pain, Weight loss, Worms in stool",Praziquantel,High,"Nausea, Dizziness",Praziquantel,"Praziquantel effectively eliminates Tapeworm Infection. Some side effects, but it's crucial for eradicating the worms."
Schistosomiasis,"Abdominal pain, Blood in urine, Fatigue",Praziquantel,High,"Headache, Dizziness",Praziquantel,"Praziquantel is effective against Schistosomiasis. Some side effects, but it aids in eliminating the worms."
Echinococcosis,"Abdominal pain, Cysts in organs, Allergic reactions",Albendazole,High,"Nausea, Headache",Albendazole,"Albendazole is crucial for treating Echinococcosis. Some side effects, but it's necessary for eliminating the worms."
Onchocerciasis (River Blindness),"Itchy skin, Visual impairment",Ivermectin,High,"Dizziness, Fatigue",Ivermectin,"Ivermectin effectively treats Onchocerciasis. Some side effects, but it's crucial for preventing blindness caused by the worms."
Conjunctivitis (Pink Eye),"Redness, Itchiness, Watery eyes","Antibiotic eye drops (e.g., Tobramycin)",High,"Burning sensation, Temporary blurred vision",Tobramycin,Tobramycin eye drops effectively treat bacterial conjunctivitis. Mild side effects are worth the quick relief.
Glaucoma,"Gradual vision loss, Eye pain, Halos around lights","Prostaglandin analogs (e.g., Latanoprost)",High,"Eye irritation, Darkening of the iris",Latanoprost,"Latanoprost has effectively controlled my glaucoma. Some eye irritation, but the benefits are crucial for preserving vision."
Cataracts,"Cloudy vision, Sensitivity to light, Double vision",Cataract surgery (no specific medicine),N/A,N/A,N/A,"Cataract surgery is the primary treatment, and it has restored my vision. No medication needed."
Macular Degeneration,"Blurred vision, Distorted vision, Central vision loss","Anti-VEGF drugs (e.g., Ranibizumab)",High,"Eye pain, Redness",Ranibizumab,"Ranibizumab injections have slowed the progression of macular degeneration. Some discomfort, but vision improvement is noticeable."
Retinal Detachment,"Flashes of light, Floaters, Sudden vision loss",Surgery (no specific medicine),N/A,N/A,N/A,"Surgery for retinal detachment saved my vision. No medication, and the recovery was well worth it."
Dry Eye Syndrome,"Dryness, Burning sensation, Blurred vision","Artificial tears, Cyclosporine eye drops",Moderate,"Temporary stinging, Watery eyes",Cyclosporine,"Cyclosporine eye drops have improved my dry eye symptoms. Some initial discomfort, but the relief is significant."
Keratitis,"Eye pain, Redness, Blurred vision","Antibiotic eye drops (e.g., Ciprofloxacin)",High,"Stinging sensation, Temporary blurred vision",Ciprofloxacin,"Ciprofloxacin eye drops effectively treat bacterial keratitis. Some temporary discomfort, but the infection clears up quickly."
Uveitis,"Eye redness, Blurred vision, Eye pain","Corticosteroid eye drops (e.g., Prednisolone)",High,"Increased intraocular pressure, Cataract formation",Prednisolone,"Prednisolone eye drops have effectively treated my uveitis. Some side effects, but the benefits are crucial for managing inflammation."
Strabismus,"Crossed eyes, Double vision, Eye misalignment","Corrective lenses, Eye muscle surgery (no specific medicine)",N/A,N/A,N/A,"Corrective lenses and eye muscle surgery have successfully treated my strabismus. No medication, and vision is now properly aligned."
Type 1 Diabetes,"Excessive thirst, Frequent urination, Fatigue",Insulin injections,High,"Hypoglycemia, Injection site reactions",Insulin,Insulin injections are vital for managing my Type 1 Diabetes. The benefits in controlling blood sugar levels outweigh the inconvenience of injections.
Type 2 Diabetes,"Increased thirst, Frequent urination, Fatigue",Metformin,High,"Nausea, Diarrhea",Metformin,"Metformin has been effective in managing my Type 2 Diabetes. Some side effects initially, but they subside with time."
Gestational Diabetes,"Excessive thirst, Frequent urination, Fatigue","Dietary management, Insulin if needed",Moderate,Varies,Varies,Dietary management and insulin if needed have helped control my gestational diabetes. Regular monitoring is key.
Diabetic Retinopathy,"Blurred vision, Floaters, Vision loss","Anti-VEGF drugs (e.g., Ranibizumab)",High,"Eye pain, Redness",Ranibizumab,"Ranibizumab injections have slowed the progression of diabetic retinopathy. Some discomfort, but vision improvement is noticeable."
Diabetic Neuropathy,"Numbness, Tingling, Burning sensation","Gabapentin, Pregabalin",Moderate,"Drowsiness, Dizziness","Gabapentin, Pregabalin","Gabapentin and pregabalin have helped manage my diabetic neuropathy symptoms. Some drowsiness, but the relief is significant."
Diabetic Nephropathy,"Edema (swelling), Protein in urine, High blood pressure","ACE inhibitors (e.g., Enalapril)",High,"Cough, Dizziness",Enalapril,"Enalapril has effectively controlled my diabetic nephropathy. Some side effects, but it's crucial for kidney protection."
Hypoglycemia,"Shakiness, Sweating, Confusion","Glucose gel, Glucagon injection",High,"Nausea, Rapid heartbeat",Varies,Glucose gel and glucagon injection are rapid and effective for treating hypoglycemia. Side effects are short-lived compared to the benefits.
Hyperglycemia,"Increased thirst, Frequent urination, Fatigue","Insulin, Oral antidiabetic drugs",High,"Hypoglycemia, Weight gain",Varies,"Insulin and oral antidiabetic drugs help manage hyperglycemia. Some side effects, but the benefits in blood sugar control are crucial."
Diabetic Ketoacidosis (DKA),"Deep, rapid breathing, Fruity-smelling breath, Confusion","Insulin, Fluid replacement",High,"Hypoglycemia, Electrolyte imbalances",Insulin,Insulin and fluid replacement are essential for treating diabetic ketoacidosis. The side effects are manageable compared to the life-saving effects.
Lipohypertrophy,Localized swelling at injection site,"Proper injection technique, Rotation of injection sites",Moderate,Varies,Varies,"Proper injection technique and site rotation help prevent lipohypertrophy. No specific medicine, but essential for insulin absorption."
Peripheral Artery Disease (PAD),"Leg pain, Numbness, Weakness","Antiplatelet medications (e.g., Aspirin)",High,"Bleeding risk, Upset stomach",Aspirin,"Aspirin has been effective in managing my PAD. Some side effects, but it's crucial for reducing the risk of complications."
Toxoplasmosis,"Flu-like symptoms, Muscle aches, Swollen lymph nodes","Pyrimethamine, Sulfadiazine",High,"Nausea, Rash","Pyrimethamine, Sulfadiazine","Pyrimethamine and sulfadiazine effectively treat toxoplasmosis. Some side effects, but they are manageable during treatment."
Giardiasis,"Abdominal pain, Diarrhea, Nausea",Metronidazole,High,"Metallic taste, Nausea",Metronidazole,"Metronidazole is effective against giardiasis. Some side effects, but they are temporary compared to the relief it provides."
Trypanosomiasis (African Sleeping Sickness),"Fever, Headache, Swollen lymph nodes","Suramin, Eflornithine",High,"Nausea, Dizziness","Suramin, Eflornithine","Suramin and eflornithine are vital for treating African sleeping sickness. Some side effects, but they are necessary for recovery."
